{
  "schema_version": 0,
  "id": "reviewer",
  "context": [
    "task.objective",
    "task.state",
    "option.target",
    "option.lineage.direct",
    "claim.related",
    "artifact.metadata",
    "artifact.content",
    "test.result",
    "review.findings",
    "ledger.resource"
  ],
  "capabilities": [
    {
      "name": "review.decide"
    },
    {
      "name": "claim.publish"
    },
    {
      "name": "process.execute",
      "scope": "lease.sandbox"
    }
  ],
  "limits": {
    "lease.wall_ms": 600000
  },
  "influence": {}
}
